{
  "schema": "xcodebuildmcp.output.test-result",
  "schemaVersion": "3",
  "didError": false,
  "error": null,
  "data": {
    "request": {
      "scheme": "CalculatorApp",
      "workspacePath": "example_projects/iOS_Calculator/CalculatorApp.xcworkspace",
      "derivedDataPath": "<TMPDIR>",
      "platform": "iOS",
      "deviceId": "<UUID>",
      "target": "device",
      "onlyTesting": [
        "CalculatorAppTests/CalculatorAppTests/testAddition"
      ],
      "skipTesting": []
    },
    "summary": {
      "status": "SUCCEEDED",
      "durationMs": 1234,
      "counts": {
        "passed": 1,
        "failed": 0,
        "skipped": 0
      },
      "target": "device"
    },
    "artifacts": {
      "deviceId": "<UUID>",
      "buildLogPath": "~/Library/Developer/XcodeBuildMCP/workspaces/XcodeBuildMCP-<HASH>/logs/test_device_<TIMESTAMP>_pid<PID>.log",
      "xcresultPath": "~/Library/Developer/XcodeBuildMCP/workspaces/XcodeBuildMCP-<HASH>/result-bundles/test_device_<TIMESTAMP>_pid<PID>.xcresult",
      "testProductsPath": "~/Library/Developer/XcodeBuildMCP/workspaces/XcodeBuildMCP-<HASH>/test-products/test_device_<TIMESTAMP>_pid<PID>.xctestproducts"
    },
    "tests": {
      "selected": [
        "CalculatorAppTests/CalculatorAppTests/testAddition"
      ],
      "discovered": {
        "total": 1,
        "items": [
          "CalculatorAppTests/CalculatorAppTests/testAddition"
        ]
      }
    },
    "diagnostics": {
      "warnings": [],
      "errors": [],
      "testFailures": []
    },
    "testCases": [
      {
        "suite": "CalculatorAppTests",
        "test": "testAddition",
        "status": "passed",
        "durationMs": 0
      }
    ]
  }
}
